{
  "hypothesis_id": "HYP-000001",
  "statement": "SGN-000001 may share a morphological relationship with the sign instance SGN-000002.",
  "status": "proposed",
  "evidence_ids": [
    "EVD-000001"
  ],
  "counter_evidence_ids": [
    "EVD-000002"
  ],
  "confidence": 25.0,
  "confidence_basis": "Supported only by a single moderate visual match; no independent geographic, chronological, or linguistic evidence has been evaluated.",
  "alternative_hypotheses": [],
  "created_by": "human_annotator_01",
  "created_at": "2026-01-15T00:00:00Z",
  "modified_at": null,
  "notes": "Illustrative fixture for schema validation, not an asserted research claim."
}
